{
  "scope": "member",
  "organization": "VoodoOps",
  "username": "alice",
  "description": "Onboard Alice as DevSecOps team member with maintainer privileges",
  "role": "member",
  "teams": [
    "DevSecOps",
    "Infrastructure"
  ],
  "permissions": {
    "admin": false,
    "maintain": true,
    "push": true,
    "triage": false,
    "pull": true
  }
}
